{
  "id": "story.b1.14.classic",
  "title": "A delejes gépember és a jövő masinái",
  "level": "B1",
  "order": 14,
  "type": "classics",
  "estimatedMinutes": 7,
  "summary": "An adaptation inspired by the visionary satirical writings of Frigyes Karinthy on technology, thinking machines, and communication. Karinthy visits an eccentric inventor's workshop in Budapest, where a thinking metal machine attempts to write poetry.",
  "characters": [
    "Karinthy Frigyes",
    "A professzor"
  ],
  "location": "Budapest, New York kávéház és műhely",
  "author": "Karinthy Frigyes",
  "work": "Így írtok ti / Tanár úr kérem és egyéb tárcák",
  "paragraphs": [
    {
      "type": "narration",
      "text": "A pesti kávéház füstös sarkában a különc professzor egy nagy, sárgaréz alkatrészekből álló dobozt tett az asztalra. Karinthy Frigyes kíváncsian hajolt közelebb."
    },
    {
      "type": "dialogue",
      "speaker": "A professzor",
      "text": "Nézze csak, kedves barátom! Ez a jövő csodája: egy automata delejes készülék, amely gombok nyomására gondolatokat közvetít!"
    },
    {
      "type": "narration",
      "text": "A szerkezet belsejében fogaskerekek kattogtak, apró villanykörték gyúltak ki, és a gép finom zümmögéssel életre kelt."
    },
    {
      "type": "dialogue",
      "speaker": "Karinthy Frigyes",
      "text": "Bámulatos! De vajon meg tudja-e oldani a legnehezebb feladatot? Képes-e ez a fémdoboz szerelmes verset írni a New York kávéház kisasszonyának?"
    },
    {
      "type": "narration",
      "text": "A professzor beállította a kart, és a gép egy hosszú papírcsíkot dobott ki. Karinthy felolvasta a szöveget: 'A delej kattog, a lélek csattog, jaj, de hideg a vas!'"
    },
    {
      "type": "dialogue",
      "speaker": "Karinthy Frigyes",
      "text": "Egészen kiváló modern költemény! Ha nem mondja, hogy masina költötte, azt hinném, a legújabb folyóirat vezércikke!"
    },
    {
      "type": "narration",
      "text": "A vendégek körülöttük nevetésben törtek ki. Karinthy elgondolkodva simította meg a hideg fémet: a jövő gépei bármilyen okosak is lesznek, a nevetést soha nem tanulják meg."
    },
    {
      "type": "dialogue",
      "speaker": "Karinthy Frigyes",
      "text": "A technika nagyszerű szolga, de veszedelmes úr. Tanuljunk meg embernek maradni a masinák között!"
    }
  ],
  "narration": {
    "pedagogical": {
      "comprehensionQuestions": [
        {
          "question": "Mi Karinthy történetének legfontosabb gondolata a technikai gépekről és az emberiségről?",
          "options": [
            "A gépek hamarosan teljesen feleslegessé teszik az emberi költészetet és irodalmat.",
            "A modern szerkezetek veszélyesek, ezért minden kávéházból ki kell tiltani őket.",
            "A technika nagyszerű szolga lehet, de az igazi emberi humort és érzéseket nem tudja pótolni.",
            "A professzoroknak több automata gépet kellene gyártaniuk a pesti lapok számára."
          ],
          "correctIndex": 2,
          "explanation": "Karinthy zárszava és a történet tanulsága szerint a technika nagyszerű szolga, de veszedelmes úr; a jövő gépei bármilyen okosak is lesznek, a nevetést soha nem tanulják meg."
        },
        {
          "question": "Milyen sort nyomtat ki a papírcsíkra a professzor delejes készüléke?",
          "options": [
            "„A csillagok ragyognak, a szív dobog, vár a kedvesem.”",
            "„Fogaskerekek forognak a kávéházi asztal sötét mélyén.”",
            "„Ne bántsd a gépet, mert a gép mindent jobban tud nálad!”",
            "„A delej kattog, a lélek csattog, jaj, de hideg a vas!”"
          ],
          "correctIndex": 3,
          "explanation": "A professzor gépéből kicsúszó hosszú papírcsíkon pontosan ez a sor szerepel: „A delej kattog, a lélek csattog, jaj, de hideg a vas!”"
        },
        {
          "question": "Karinthy szerint mi az a kizárólagosan emberi sajátosság, amit a jövő gépei soha nem fognak megtanulni?",
          "options": [
            "A nevetés és a szívből jövő humor.",
            "A gyors és pontos mechanikus számolás.",
            "A villanykörték fényének bekapcsolása.",
            "A papírcsíkok egyenes elvágása."
          ],
          "correctIndex": 0,
          "explanation": "Karinthy elgondolkodva simítja meg a gépet, és megállapítja: a jövő gépei bármilyen okosak is lesznek, a nevetést soha nem tanulják meg."
        }
      ]
    }
  }
}
