{
  "id": "a2-original-imperativonegativo",
  "title": "Las reglas del hostel",
  "lesson": 5,
  "level": "A2",
  "order": 24,
  "type": "original",
  "summary": "Carlos y Meg llegan a un acogedor albergue en Hội An y aprenden a convivir respetando las normas de la casa.",
  "characters": [
    "Carlos",
    "Meg",
    "la recepcionista"
  ],
  "location": "Hội An, Vietnam",
  "grammar": [
    "imperativo negativo",
    "normas y prohibiciones"
  ],
  "vocabularyTopics": [
    "hostel",
    "convivencia",
    "reglas"
  ],
  "estimatedMinutes": 5,
  "paragraphs": [
    {
      "id": 1,
      "text": "Carlos y Meg llegan a un albergue tradicional cerca del casco antiguo de Hội An."
    },
    {
      "id": 2,
      "text": "La recepcionista les sonríe amablemente y les entrega la llave de la habitación compartida."
    },
    {
      "id": 3,
      "text": "«Bienvenidos», dice en un español excelente. «Por favor, escuchen las normas de convivencia de la casa»."
    },
    {
      "id": 4,
      "text": "«Primero: no hagan ruido en los dormitorios después de las diez de la noche. Muchos viajeros madrugan para visitar las playas»."
    },
    {
      "id": 5,
      "text": "«Segundo: no dejen platos sucios en la cocina común. Limpien y sequen todo después de usarlo»."
    },
    {
      "id": 6,
      "text": "«Y por último: no olviden quitarse los zapatos antes de entrar a la sala principal. ¡Disfruten mucho de su estancia!»."
    },
    {
      "id": 7,
      "text": "Carlos y Meg asienten con una sonrisa. Respetar las costumbres locales hace que viajar sea mucho más enriquecedor."
    }
  ],
  "narration": {
    "pedagogical": {
      "comprehensionQuestions": [
        {
          "question": "¿Qué les explica la recepcionista a Carlos y Meg?",
          "options": [
            "Ofrecerles descuentos en excursiones por los templos de Hội An.",
            "Explicar las normas de convivencia básicas del albergue a los huéspedes.",
            "Informar sobre los mejores restaurantes de comida española de la zona.",
            "Cambiar a los viajeros a una habitación privada más cara."
          ],
          "correctIndex": 1,
          "explanation": "La recepcionista da la bienvenida a Carlos y Meg y les explica tres normas: no hacer ruido después de las diez, no dejar platos sucios en la cocina y quitarse los zapatos antes de entrar a la sala."
        },
        {
          "question": "¿A qué hora debe respetarse el silencio en los dormitorios del albergue?",
          "options": [
            "A partir de las diez de la noche.",
            "Desde las ocho de la tarde.",
            "Únicamente a medianoche.",
            "Durante toda la tarde mientras los huéspedes duermen la siesta."
          ],
          "correctIndex": 0,
          "explanation": "La recepcionista dice: «no hagan ruido en los dormitorios después de las diez de la noche», porque muchos viajeros madrugan para visitar las playas."
        },
        {
          "question": "¿Qué norma adicional da la recepcionista sobre la sala principal?",
          "options": [
            "Que hay que reservar mesa con antelación para sentarse.",
            "Que está prohibido comer en la sala después de las nueve.",
            "Que hay que quitarse los zapatos antes de entrar.",
            "Que solo se puede entrar con ropa tradicional vietnamita."
          ],
          "correctIndex": 2,
          "explanation": "La recepcionista indica: «no olviden quitarse los zapatos antes de entrar a la sala principal», como parte de las normas de convivencia del albergue en Hội An."
        }
      ]
    }
  }
}
