{
  "id": "story.c1.world.tudomanyelmelet",
  "title": "A megismerés határai: Polányi, Lakatos és a tudományos forradalmak",
  "level": "C1",
  "type": "world",
  "summary": "Complete exploration of Hungarian contributions to epistemology and scientific philosophy: Michael Polanyi, Imre Lakatos, John von Neumann, the critique of pure objectivity, and modern bioethics.",
  "paragraphs": [
    {
      "type": "narration",
      "text": "A huszadik század a tudomány diadalmenetének korszaka volt, de egyben az önreflexió forradalma is. Magyar származású gondolkodók sora játszott döntő szerepet abban, hogy a világ újragondolja a megismerés, a bizonyosság és a tudományos fejlődés természetét."
    },
    {
      "type": "narration",
      "text": "Polányi Mihály lerombolta a rideg objektivizmus mítoszát, amikor felmutatta a 'hallgatólagos tudás' és a kutatói elköteleződés nélkülözhetetlenségét. Rávilágított, hogy a tudomány legmélyén nem mechanikus algoritmusok, hanem a tudósközösség morális felelőssége és a felfedezés személyes szenvedélye pulzál."
    },
    {
      "type": "narration",
      "text": "Lakatos Imre a tudományos kutatási programok metodológiájával megmentette a tudomány racionalitását a popperi naiv cáfolat és a kuhni irracionális relativizmus között őrlődő filozófiában. Bebizonyította, hogy az elméletek rugalmas védőövekkel küzdenek a fennmaradásukért, és a fejlődést a progresszív problémaváltások jelzik."
    },
    {
      "type": "narration",
      "text": "Neumann János eközben a modern digitális civilizáció alapjait fektette le a számítógép-architektúra és a játékelmélet kidolgozásával, miközben prófétai éleslátással figyelmeztetett a technológiai fejlődés szingularitására és a gépi intelligencia határaira."
    },
    {
      "type": "narration",
      "text": "A huszonegyedik században ez az örökség a bioetika és a technológiaetika kihívásaiban él tovább. Amikor az emberi génállomány és a digitális tudat határait feszegetjük, újra meg kell tanulnunk: a megismerés igazi mércéje nem a gátlástalan hatalomvágy, hanem az emberi méltóság és a jövő iránti alázatos felelősségvállalás."
    }
  ]
}
