{
  "id": "b2-colombiaperiferias-04",
  "title": "El camino hacia la paz: Verdad, memoria y dignidad restaurada",
  "level": "B2",
  "lesson": 4,
  "type": "world",
  "estimatedMinutes": 8,
  "summary": "Crónica sociopolítica de nivel B2 sobre la superación del conflicto armado en Colombia: el impacto humanitario de más de cincuenta años de confrontación, la firma del histórico Acuerdo de Paz de 2016, la labor pionera de la Jurisdicción Especial para la Paz (JEP) y el coraje de las víctimas como guardianas de la memoria y la reconciliación.",
  "characters": [
    "Luz Marina Bernal",
    "Magistrado Cifuentes",
    "Danilo"
  ],
  "paragraphs": [
    {
      "type": "narration",
      "text": "Durante más de medio siglo de confrontación armada ininterrumpida, Colombia padeció el conflicto bélico interno más prolongado y desgarrador de todo el hemisferio occidental. Un entramado trágico de guerrillas insurgentes de orientación marxista, sanguinarios escuadrones paramilitares de extrema derecha, agentes estatales corruptos y redes transnacionales del narcotráfico dejó un saldo estremecedor de más de nueve millones de víctimas reconocidas en el registro oficial: cientos de miles de muertos, más de cien mil personas desaparecidas forzadamente en fosas clandestinas y el éxodo forzado de más de siete millones de campesinos, indígenas y afrodescendientes despojados de sus parcelas ancestrales."
    },
    {
      "type": "narration",
      "text": "Aquella pesadilla que parecía condenar a la nación a una espiral perpetua de violencia dio un paso trascendental hacia la esperanza en noviembre de 2016 con la firma en el Teatro Colón de Bogotá del Acuerdo Final de Paz entre el Estado colombiano y la guerrilla de las FARC-EP, tras cuatro intensos años de negociaciones diplomáticas en La Habana con el acompañamiento de garantes internacionales como Noruega y Cuba. El acuerdo no solo contempló la entrega y fundición de más de nueve mil armas bajo la estricta verificación de la ONU, sino que articuló una ambiciosa reforma rural integral y colocó por primera vez en la historia de los pactos de paz a las víctimas en el centro absoluto de las soluciones."
    },
    {
      "type": "narration",
      "text": "La columna vertebral ética de este proceso fue la creación del Sistema Integral de Verdad, Justicia, Reparación y No Repetición, destacándose como tribunal inédito la Jurisdicción Especial para la Paz (JEP). A diferencia de los modelos judiciales punitivos tradicionales orientados exclusivamente al encierro penitenciario en celdas cerradas, la JEP implementó un paradigma vanguardista de 'justicia transicional restaurativa'. Bajo este modelo, los antiguos comandantes guerrilleros y los altos oficiales militares comparecientes están obligados a aportar verdad exhaustiva y detallada sobre sus crímenes, reconocer públicamente su responsabilidad frente a los deudos y ejecutar obras tangibles de desminado humanitario o construcción de escuelas para resarcir el daño causado."
    },
    {
      "type": "narration",
      "text": "En las salas de audiencias solemnes de la JEP, el dolor histórico se transforma en verdad liberadora. Luz Marina Bernal, una de las admiradas 'Madres de Soacha' cuyo hijo con discapacidad fue secuestrado por soldados y asesinado para presentarlo falsamente como un guerrillero abatido en combate —en el marco del siniestro escándalo de los 'falsos positivos'—, mira a los ojos a los militares retirados. Con una dignidad que conmueve al país entero, Luz Marina sostiene la fotografía de su hijo mientras los oficiales confiesan la verdad y piden perdón de rodillas: 'No buscamos venganza ni deseamos que sus madres lloren lo que nosotras lloramos; exigimos la verdad plena para que ninguna otra madre colombiana tenga que buscar a su hijo en un cementerio anónimo'."
    },
    {
      "type": "narration",
      "text": "Simultáneamente, la Comisión para el Esclarecimiento de la Verdad, liderada por el jesuita Francisco de Roux, recorrió los confines más remotos de la patria escuchando más de treinta mil testimonios de víctimas, soldados, campesinos y expresidentes para alumbrar un monumental Informe Final titulado 'Hay futuro si hay verdad'. El documento reveló que el conflicto no fue una fatalidad inevitable ni una locura abstracta, sino el desenlace de profundas desigualdades territoriales, la exclusión política y la incapacidad de una sociedad para tramitar sus diferencias sin recurrir al exterminio del adversario."
    },
    {
      "type": "narration",
      "text": "Paralelamente, la Unidad de Búsqueda de Personas Dadas por Desaparecidas (UBPD) despliega una labor humanitaria y extrajudicial incansable a lo largo y ancho de la geografía nacional, exhumando cuerpos en cementerios clandestinos y riberas fluviales para devolver la paz espiritual a familias que buscaron a sus seres queridos durante décadas enteras. Cada entrega digna de restos óseos representa el cierre de un duelo postergado y un triunfo de la compasión humana sobre el olvido burocrático, recordando que no habrá reconciliación auténtica mientras una sola familia permanezca en la incertidumbre sobre el destino de sus desaparecidos."
    },
    {
      "type": "narration",
      "text": "El camino hacia la reconciliación plena sigue estando sembrado de formidables escollos: disidencias armadas, el asesinato sistemático de firmantes de paz y líderes comunitarios en zonas de periferia y la polarización retórica de sectores recalcitrantes. Sin embargo, en cada rincón donde una víctima perdona sin olvidar, donde excombatientes siembran café y tejen prendas de vestir junto a sus antiguos adversarios y donde la juventud abraza la memoria histórica en las escuelas, Colombia demuestra al planeta que la paz no es un decreto gubernamental, sino un pacto sagrado y colectivo por la preservación de la vida digna."
    }
  ],
  "narration": {
    "pedagogical": {
      "comprehensionQuestions": [
        {
          "question": "¿Cuál es la cifra aproximada de víctimas registradas oficialmente a lo largo del conflicto armado colombiano?",
          "options": [
            "Más de nueve millones de víctimas reconocidas en el registro estatal oficial.",
            "Menos de diez mil personas en algunas provincias aisladas.",
            "Cincuenta mil personas exclusivamente pertenecientes a las fuerzas militares.",
            "No se cuenta con ningún registro oficial sobre las víctimas."
          ],
          "correctIndex": 0,
          "explanation": "El párrafo 1 detalla que el conflicto dejó un saldo estremecedor de más de nueve millones de víctimas registradas oficialmente."
        },
        {
          "question": "¿En qué consiste el modelo de 'justicia transicional restaurativa' aplicado por la JEP?",
          "options": [
            "En exigir a los comparecientes que aporten verdad plena y reparen a las víctimas mediante obras sociales de desminado o reconstrucción, priorizando sanar el daño sobre el castigo carcelario retributivo.",
            "En aplicar la pena de muerte automática a todos los guerrilleros y militares desmovilizados.",
            "En archivar todos los expedientes sin realizar juicios ni audiencias testimoniales.",
            "En trasladar a todos los acusados a prisiones de máxima seguridad en el extranjero sin derecho a defensa."
          ],
          "correctIndex": 0,
          "explanation": "El párrafo 3 define la justicia restaurativa de la JEP: verdad plena y obras tangibles de reparación a las víctimas para resarcir el daño."
        },
        {
          "question": "¿Cuál fue la conclusión central del Informe Final de la Comisión de la Verdad liderada por Francisco de Roux?",
          "options": [
            "Que el conflicto armado fue producto de profundas desigualdades, despojos territoriales y exclusión política, y que la paz exige asumir la verdad colectiva para garantizar la no repetición.",
            "Que la violencia armada se debió exclusivamente a invasiones militares extranjeras no deseadas.",
            "Que las víctimas debían renunciar a conocer el paradero de sus familiares desaparecidos.",
            "Que la sociedad colombiana no tiene posibilidad alguna de reconciliación pacífica."
          ],
          "correctIndex": 0,
          "explanation": "El párrafo 5 analiza las conclusiones del Informe Final: el conflicto no fue una fatalidad abstracta sino el resultado de exclusiones estructurales que deben ser subsanadas con verdad."
        }
      ]
    }
  }
}
