{
  "id": "story.b1.nemzetijelkepek.01",
  "lesson": 1,
  "order": 1,
  "title": "A magyar trikolór és nemzeti színeink története",
  "level": "B1",
  "type": "world",
  "estimatedMinutes": 6,
  "summary": "Hungary's national flag is a horizontal tricolor of red, white, and green. Established during the Reform Era and codified by the 1848 revolutionary laws, its colours traditionally represent strength (red), fidelity (white), and hope (green). From the 1848 cockades to the flag with a cut-out hole in 1956, the tricolor symbolizes the nation's struggle for freedom and sovereignty.",
  "characters": [
    "Zászlóért felelős történész a Nemzeti Múzeumban",
    "Fiatal diák a márciusi ünnepségen"
  ],
  "location": "Budapest, Magyar Nemzeti Múzeum lépcsője",
  "paragraphs": [
    {
      "type": "narration",
      "text": "Magyarország hivatalos zászlaja három egyenlő szélességű vízszintes sávból áll: felül piros, középen fehér, alul zöld. Ezt az Alaptörvény I) cikke írja elő. A történészek szerint a három szín a régi magyar címerből származik."
    },
    {
      "type": "dialogue",
      "speaker": "Múzeumi történész",
      "text": "A hagyomány szerint a színeknek jelentése van: a piros az erőt, a fehér a hűséget, a zöld pedig a reményt fejezi ki."
    },
    {
      "type": "narration",
      "text": "A trikolór a reformkorban terjedt el; egyes források szerint a francia forradalom példája is hatott rá. 1848. március 15-én a forradalmi ifjúság piros-fehér-zöld kokárdát tűzött a kabátjára, s az áprilisi törvények hivatalos nemzeti jelképpé emelték a zászlót."
    },
    {
      "type": "dialogue",
      "speaker": "Fiatal diák",
      "text": "1956-ban a forradalmárok kivágták a zászló közepéből a kommunista korszak címerét. A lyukas zászló az 1956-os forradalom jelképe lett."
    },
    {
      "type": "narration",
      "text": "Ma a nemzeti trikolór a középületeken és a Parlament előtt lobog. Március 15-én sokan kokárdát tűznek a ruhájukra."
    }
  ]
}
