{
  "id": "story.b1.otvenhat.02",
  "lesson": 2,
  "order": 2,
  "title": "A pesti srácok és a Corvin köz hősei",
  "level": "B1",
  "type": "world",
  "estimatedMinutes": 6,
  "summary": "Young apprentices, students, and workers—immortalized as the 'boys of Pest'—became the legendary backbone of armed resistance. Stationed at strategic intersections like the Corvin passage and Széna tér, they used homemade Molotov cocktails to destroy dozens of heavily armored Soviet tanks.",
  "characters": [
    "Pongrátz Gergely, a Corvin köz legendás parancsnoka",
    "Tizenöt éves pesti srác",
    "Vöröskeresztes ápolónő"
  ],
  "location": "A Corvin mozi környéke és az Üllői út",
  "paragraphs": [
    {
      "type": "narration",
      "text": "A pesti utcák sarkaiból, a kapualjakból és a háztetőkről fiatalok ezrei léptek elő fegyverrel a kezükben. Sokan közülük még alig töltötték be a tizenöt-tizenhat évet: ők voltak a 'pesti srácok', a felkelők legfiatalabb harcosai."
    },
    {
      "type": "dialogue",
      "speaker": "Tizenöt éves pesti srác",
      "text": "Nem félünk a tankoktól! Ha befordul a T-34-es az Üllői útról, a sarok mögül dobjuk a Molotov-koktélt egyenesen a motortérre! Dávid és Góliát harca ez!"
    },
    {
      "type": "narration",
      "text": "A legfontosabb ellenállási gócpont a Corvin köz lett, a félköríves mozi védett épülete. Pongrátz Gergely, a Corvin köz egyik parancsnoka vezetésével a corvinisták valóságos erőddé változtatták a környéket, és tucatnyi szovjet páncélost lőttek ki a pesti aszfalton."
    },
    {
      "type": "dialogue",
      "speaker": "Corvin közi felkelő",
      "text": "Addig tartjuk a Corvin közt, amíg az utolsó szovjet tank is el nem hagyja a fővárost!"
    },
    {
      "type": "narration",
      "text": "Az utcákon a felkelők járdakövekből barikádokat emeltek. A harcok szünetében az ablakokból ételt, kenyeret és forró teát adtak le nekik. Október végén a szovjet csapatok visszavonultak a fővárosból."
    }
  ]
}
