{
  "id": "story.b1.vivienda.04",
  "title": "Servicios del hogar y compromiso con el medio ambiente",
  "level": "B1",
  "lesson": 4,
  "order": 4,
  "type": "world",
  "estimatedMinutes": 5,
  "summary": "Conocer la gestión de los suministros domésticos (luz, agua, gas, internet), el bono social eléctrico y los colores de los contenedores de reciclaje en España.",
  "characters": [],
  "location": "España",
  "grammar": [
    "clasificacion-colores-reciclaje-suministros"
  ],
  "vocabularyTopics": [
    "Vivienda, Registro y Empadronamiento",
    "Suministros domésticos, eficiencia energética y reciclaje urbano"
  ],
  "paragraphs": [
    {
      "type": "narration",
      "text": "Al instalarse en una vivienda en España —ya sea en propiedad o en alquiler—, el residente debe gestionar el alta o el cambio de titularidad de los suministros básicos del hogar: la electricidad (cuya potencia contratada se mide en kilovatios y cuyo consumo se factura en kilovatios hora), el gas natural o butano, el agua potable (gestionada por empresas municipales o mancomunadas) y la conexión de fibra óptica y telefonía móvil."
    },
    {
      "type": "narration",
      "text": "Para proteger a las familias con bajos ingresos, familias numerosas y pensionistas con pensiones mínimas, el Gobierno de España regula el «Bono Social Eléctrico» y el «Bono Social Térmico», que aplican descuentos importantes en la factura de la luz y la calefacción a través de las compañías comercializadoras de referencia (tarifa regulada PVPC). Además, para vender o alquilar cualquier vivienda en España es obligatorio disponer del Certificado de Eficiencia Energética, que califica el consumo del inmueble con una escala de letras desde la A (la más eficiente) hasta la G."
    },
    {
      "type": "narration",
      "text": "En la vida diaria de los barrios españoles, los ayuntamientos gestionan el servicio público de recogida de basuras mediante contenedores diferenciados por colores que fomentan el reciclaje y la economía circular."
    },
    {
      "type": "narration",
      "text": "Así, en el contenedor amarillo se depositan los envases de plástico, las latas de conserva o refresco y los envases tipo brik; en el contenedor azul se tiran exclusivamente el papel y las cajas de cartón plegadas; en el contenedor verde con forma de iglú se introducen las botellas, tarros y frascos de vidrio (sin tapones y sin mezclar con cristal de ventanas o vajilla de cerámica); y en el contenedor marrón se depositan los restos orgánicos de comida."
    },
    {
      "type": "narration",
      "text": "Cuando un ciudadano necesita deshacerse de residuos especiales o voluminosos que no pueden tirarse a los contenedores de la calle —como muebles viejos, colchones, ordenadores, electrodomésticos averiados, pinturas, baterías o aceite de cocina usado—, debe llevarlos gratuitamente al «Punto Limpio» municipal de su localidad."
    }
  ],
  "narration": {
    "durationSeconds": 132.3,
    "pacing": {
      "speedMultiplier": 1.0,
      "rate_str": "+0%",
      "rate_wpm": 145,
      "style": "natural, expressive"
    },
    "speakers": {
      "Narrator": {
        "role": "narrator",
        "gender": "neutral",
        "tone": "clear, warm, steady storytelling guide"
      }
    },
    "segments": [
      {
        "paraIndex": 0,
        "startTime": 0.0,
        "endTime": 29.8,
        "speaker": "Narrator",
        "lang": "es",
        "cues": [],
        "pronunciations": []
      },
      {
        "paraIndex": 1,
        "startTime": 29.8,
        "endTime": 67.6,
        "speaker": "Narrator",
        "lang": "es",
        "cues": [],
        "pronunciations": []
      },
      {
        "paraIndex": 2,
        "startTime": 67.6,
        "endTime": 80.6,
        "speaker": "Narrator",
        "lang": "es",
        "cues": [],
        "pronunciations": []
      },
      {
        "paraIndex": 3,
        "startTime": 80.6,
        "endTime": 113.8,
        "speaker": "Narrator",
        "lang": "es",
        "cues": [],
        "pronunciations": []
      },
      {
        "paraIndex": 4,
        "startTime": 113.8,
        "endTime": 132.3,
        "speaker": "Narrator",
        "lang": "es",
        "cues": [],
        "pronunciations": []
      }
    ],
    "pedagogical": {
      "keyVocabulary": [
        {
          "lemma": "el contenedor amarillo",
          "pos": "noun",
          "cefr": "B1",
          "gloss": "yellow recycling bin (plastic packaging, cans, cartons)"
        },
        {
          "lemma": "el contenedor azul",
          "pos": "noun",
          "cefr": "B1",
          "gloss": "blue recycling bin (paper and cardboard)"
        },
        {
          "lemma": "el contenedor verde",
          "pos": "noun",
          "cefr": "B1",
          "gloss": "green igloo recycling bin (glass bottles and jars)"
        }
      ],
      "targetGrammar": [
        "clasificacion-colores-reciclaje-suministros"
      ],
      "comprehensionQuestions": [
        {
          "question": "¿En qué contenedor de reciclaje de color específico deben depositarse en España las botellas de plástico, las latas metálicas y los envases tipo brik?",
          "options": [
            "En el contenedor amarillo",
            "En el contenedor azul",
            "En el iglú verde",
            "En el buzón de Correos"
          ],
          "correctIndex": 0
        },
        {
          "question": "¿Qué se deposita exclusivamente en el contenedor de reciclaje de color azul en las calles españolas?",
          "options": [
            "El papel y el cartón",
            "Las botellas de vidrio",
            "Las pilas y baterías de coche",
            "Los medicamentos caducados"
          ],
          "correctIndex": 0
        },
        {
          "question": "¿A qué instalación municipal gratuita deben llevarse los electrodomésticos viejos, muebles rotos, pinturas o aceites usados que no pueden tirarse en los contenedores normales de la calle?",
          "options": [
            "Al Punto Limpio municipal",
            "Al centro de salud",
            "Al juzgado de guardia",
            "A la estación de tren"
          ],
          "correctIndex": 0
        }
      ]
    }
  }
}
