{
  "id": "story.b2.matematikasakk.05",
  "title": "Miért jeleskednek a kis nemzetek az elvont tudományokban?",
  "level": "B2",
  "lesson": 5,
  "order": 5,
  "type": "world",
  "estimatedMinutes": 5,
  "summary": "Needing only paper, a pencil, or a chessboard rather than billion-dollar particle accelerators, mathematics, theoretical physics, and chess allowed Hungarian thinkers to compete at the global frontier regardless of economic constraints.",
  "characters": [],
  "location": "Budapest és a nemzetközi tudományos közösség",
  "grammar": [
    "b2-concessive-indefinites"
  ],
  "vocabularyTopics": [
    "Why Small Nations Excel in Abstract Disciplines"
  ],
  "paragraphs": [
    {
      "type": "narration",
      "text": "Ha végigtekintünk Bolyai János, a KöMaL-iskola, Erdős Pál, a budapesti „marslakók” vagy a Polgár nővérek történetén, óhatatlanul felmerül egy mélyebb kultúrtörténeti kérdés: miért éppen a legelvontabb szellemi területeken — a tiszta matematikában, az elméleti fizikában és a sakkban — vált Magyarország világhatalommá? A válasz egyszerre gazdasági, társadalmi és kulturális természetű."
    },
    {
      "type": "narration",
      "text": "A tizenkilencedik és a huszadik században egy közép-európai kis országnak ritkán állt rendelkezésére annyi tőke, hogy óriási tengeri flottákat, drága részecskegyorsítókat vagy hatalmas ipari kutatólaboratóriumokat építsen. A matematikához és a sakkhoz azonban nincs szükség milliárdos berendezésekre: bármilyen szerény körülmények között él is egy tehetséges fiatal, egyetlen ceruza, néhány ív papír és egy sakktábla elegendő ahhoz, hogy a világ élvonalába kerüljön."
    },
    {
      "type": "narration",
      "text": "Ugyanakkor a tőke hiánya önmagában nem teremt tudományt. Ahhoz, hogy a papíron és ceruzán megszülessenek a nagy gondolatok, olyan szellemi közegre volt szükség, amely társadalmi rangot adott az észnek. Magyarországon a gimnáziumi tanárok, a matematikai versenyek és a sakk-klubok olyan hagyományt építettek fel, amelyben a szellemi teljesítményt bárki elismerte, függetlenül a családi háttértől."
    },
    {
      "type": "narration",
      "text": "Ráadásul a matematika és a sakk egyetemes nyelv: akár tud valaki angolul vagy németül, akár csak most tanulja a világnyelveket, egy elegáns egyenletet vagy egy huszárlépést a Föld bármelyik pontján azonnal megértenek. Ez az egyetemesség tette lehetővé, hogy a történelmi viharok idején is fennmaradjon a magyar szellemi jelenlét a nemzetközi életben."
    },
    {
      "type": "narration",
      "text": "Bárhogyan alakul is a huszonegyedik század technológiája — a mesterséges intelligenciától a kvantumszámítógépekig —, az elvont, fegyelmezett és mégis játékos gondolkodás művészete továbbra is a magyar kultúra egyik legértékesebb öröksége marad."
    }
  ]
}
