{
  "id": "story.c1.egeszsegugy.03",
  "title": "Az ápolói elvándorlás és a szülészetek leállása",
  "level": "C1",
  "lesson": 3,
  "order": 3,
  "type": "world",
  "estimatedMinutes": 3,
  "grammar": [
    "c1-adv-proportional-nurse-shortage"
  ],
  "vocabularyTopics": [
    "Healthcare in Crisis: Doctor Wage Reforms, Nurse Shortages & Chamber Control",
    "Nurse Drain vs. Wage Gap Proportional Correlatives"
  ],
  "summary": "Az ápolók és műtősök hiánya miatt országszerte szülészetek és sürgősségi osztályok kényszerültek ideiglenes vagy végleges bezárásra.",
  "paragraphs": [
    {
      "type": "narration",
      "text": "2023-ban sokkoló hírek lepték el a sajtót: Szolnokon, Keszthelyen, Mohácson és Budapest több kerületében sorra jelentették be a szülészeti és gyermekgyógyászati ügyeletek leállását. A kórtermekben ott álltak a modern inkubátorok, de nem volt szakápoló, aki bekapcsolja őket."
    },
    {
      "type": "dialogue",
      "speaker": "Dr. Molnár Péter",
      "text": "Minél inkább elmarad a szakdolgozók fizetése az orvosokétól, annál gyorsabban néptelenednek el a kórtermek. Egy intenzív osztályon egy ápolóra nem juthat öt lélegeztetett beteg anélkül, hogy ne következne be tragédia."
    },
    {
      "type": "narration",
      "text": "A magyar ápolónők ezrei Ausztriában, Németországban vagy a hazai magánklinikákon vállaltak munkát, ahol emberi munkaidőt és tisztes megélhetést biztosítottak számukra."
    },
    {
      "type": "narration",
      "text": "Amilyen mértékben elmélyült a szakemberhiány, olyan arányban vált a magyar állami ellátás az orvosok és betegek mindennapi túlélési harcává."
    }
  ]
}
