{
  "id": "story.b2.talalmanyok.03",
  "title": "Bíró László és a gyorsan száradó nyomdafesték",
  "level": "B2",
  "lesson": 3,
  "order": 3,
  "type": "world",
  "estimatedMinutes": 5,
  "summary": "Frustrated by smudging fountain pens in Budapest editorial offices, journalist László Bíró noticed how fast newspaper ink dried on rotary presses and created the capillary ballpoint pen with his brother György.",
  "characters": [],
  "location": "Budapest, Párizs és Buenos Aires (1931–1945)",
  "grammar": [
    "b2-obligatory-participle"
  ],
  "vocabularyTopics": [
    "László Bíró and the Pen That Never Smudged"
  ],
  "paragraphs": [
    {
      "type": "narration",
      "text": "Az 1930-as évek Budapestjén Bíró László újságíróként és szerkesztőként naponta bosszankodott a hagyományos töltőtollakon: a vékony acélhegy gyakran felsértette a papírt, a vízalapú tinta pedig elkenődött a kéziratokon, és hosszú percekig kellett itatóspapírral szárítgatni a sürgősen nyomdába küldendő cikkeket."
    },
    {
      "type": "narration",
      "text": "Amikor Bíró egy pesti nyomdában figyelte a hatalmas forgó hengereket, észrevette, hogy a sűrű nyomdafesték a papírral érintkezve szinte azonnal megszárad, és nem hagy foltot maga után. Ebből a megfigyelésből született meg a gondolat: olyan írószert kell készíteni, amelynek hegyében egy apró, szabadon forgó acélgolyó viszi fel a sűrű festéket a papírra."
    },
    {
      "type": "narration",
      "text": "A megoldandó kémiai és fizikai nehézségek azonban óriásiak voltak, mert a sűrű festék a hagyományos csövekben nem folyt le a tollhegyig. Bíró László ezért fogorvos és vegyész testvére, Bíró György segítségével kezdte kikísérletezni a megfelelő viszkozitású pasztát, valamint a hajszálcsövesség (kapillaritás) elvén működő adagolócsatornákat."
    },
    {
      "type": "narration",
      "text": "Az első szabadalmat még 1938-ban Budapesten és Párizsban jegyeztették be, ám a fasizmus elől a testvérpárnak emigrálnia kellett, és 1940-ben Argentínában, Buenos Airesben telepedtek le. Ott alapították meg üzemüket, ahol a „Birome” néven forgalomba hozott golyóstoll rövid idő alatt meghódította a piacot; Argentínában a feltaláló születésnapján, szeptember 29-én ma is a Feltalálók Napját ünneplik."
    },
    {
      "type": "narration",
      "text": "A második világháború alatt a Brit Királyi Légierő harmincezer darabot rendelt a golyóstollból, mert a pilóták térképein nagy magasságban, alacsony légnyomás mellett sem folyt ki belőle a festék. A angol nyelvben azóta is „biro” néven emlegetett találmány így vált a huszadik század legelterjedtebb használati tárgyává."
    }
  ]
}
