{
  "id": "story.c1.munkaeropiac",
  "title": "A kettészakadt munka világa: vendégmunkások, futószalagok és az elvándorlás kora",
  "level": "C1",
  "type": "world",
  "order": 21,
  "lesson": 5,
  "estimatedMinutes": 8,
  "summary": "Panoramic investigation of Hungary's dual labor market: the rapid importation of third-country guest workers, assembly-line exhaustion in battery megafactories, the gig economy under algorithmic control, the paralysis of strike rights, and the thousands commuting daily across the Austrian border.",
  "grammar": [
    "c1-discourse-polarization-antithesis",
    "c1-adv-temporal-succession-chains",
    "c1-modal-teleological-labor-policy",
    "c1-epistemic-labor-market-projections",
    "c1-adv-synthetic-collective-evaluatives"
  ],
  "vocabularyTopics": [
    "The Dual Labor Market: Guest Workers, Gig Economy & Wage Convergence",
    "Guest Workers, Third-Country Labor & Polarization Antithesis",
    "Industrial Assembly Lines & Temporal Succession Chains",
    "Platform Capitalism, Gig Economy & Teleological Labor Policy",
    "Strike Rights, Wildcat Actions & Epistemic Forecasts",
    "Brain Drain, Austrian Commuting & Synthetic Collective Evaluation"
  ],
  "paragraphs": [
    {
      "type": "narration",
      "text": "A huszonegyedik század harmadik évtizedében a magyar munkaerőpiac mély és drámai átalakuláson megy keresztül. A kormányzati gazdaságpolitika az újraiparosítás és az akkumulátorgyártás zászlaja alatt hatalmas nemzetközi tőkét vonzott az országba, ám e beruházások nyomán nem az ígért polgári jólét, hanem egy élesen kettészakadt, törékeny és polarizált munkavilág jött létre."
    },
    {
      "type": "narration",
      "text": "A gyárak és ipari parkok környékén vendégmunkások tízezrei dolgoznak szigorúan ellenőrzött konténerszállásokról ingázva a futószalagokhoz, míg a hazai fizikai munkások a bérletörés és az embertelen normaemelések szorításában vergődnek. Ezzel párhuzamosan a nagyvárosokban a platformkapitalizmus hozott létre egy új, jogfosztott réteget: az algoritmusok által vezérelt ételfutárokat és kisvállalkozókat, akik a KATA eltörlése után minden korábbinál kiszolgáltatottabbá váltak."
    },
    {
      "type": "narration",
      "text": "Amikor pedig a munkavállalók szót emelnének az érdekeikért, a sztrájkjog adminisztratív elfojtásával és a minimális szolgáltatások kényszerével találják szemben magukat. A tanárok polgári engedetlensége és a gyári vadsztrájkok világosan jelzik: a törvényes érdekvédelmi utak eltorlaszolása nem békét, hanem radikalizálódást és a társadalmi kohézió felbomlását eredményezi."
    },
    {
      "type": "narration",
      "text": "Mindent összegezve, a hajnali soproni vonatokon Ausztriába ingázó tízezrek a hazai bérfelzárkózás elmaradásának élő mementói. Magyarország nem maradhat fenn tartósan egy olcsó, jogfosztott összeszerelő gyarmatként. A nemzeti megmaradás és az emberi méltóság elemi követelménye, hogy a gazdaságpolitika a dolgozói jogok garantálására, a tisztes európai bérekre és a tudásalapú innovációra építse a jövőjét."
    }
  ]
}
