{
  "id": "story.c1.visegrad",
  "title": "A visegrádi horizont: Közép-Európa ezeréves útja és geopolitikai jövője",
  "level": "C1",
  "type": "world",
  "order": 17,
  "lesson": 5,
  "estimatedMinutes": 8,
  "summary": "Panoramic exploration of Central European geopolitics and the Visegrád Group: from the medieval 1335 royal summit and the 1991 democratic renaissance under Havel, Antall, and Wałęsa, North-South transport and LNG energy interconnectors (Via Carpatia), geopolitical fracturing over Russia and Ukraine, cohesion funding dynamics, to the philosophical future of Central European identity within Europe.",
  "grammar": [
    "c1-discourse-divergence-markers",
    "c1-concessive-stipulative-clauses",
    "c1-rhetorical-antithetical-parallelism",
    "c1-modal-deontic-treaty-predicates",
    "c1-adv-discourse-summation-particles"
  ],
  "vocabularyTopics": [
    "The Visegrád Group (V4), Regional Alliances & European Cohesion",
    "Historical Rebirth: 1335 Royal Summit to 1991 Visegrád Declaration",
    "North-South Connectivity, Energy Corridors & Via Carpatia",
    "Geopolitical Divergence: Ukraine, Russia & The Fracturing of the V4",
    "Cohesion Funds, EU Budget Bargaining & The Three Seas Initiative",
    "The Future of Central Europe: Bridge, Buffer, or Sovereign Core?"
  ],
  "paragraphs": [
    {
      "type": "narration",
      "text": "Közép-Európa sorsa mindig is a történelem és a földrajz metszéspontjában formálódott. Amikor Károly Róbert 1335-ben Visegrádra hívta a lengyel és cseh uralkodót, egy olyan regionális együttműködés alapjait rakta le, amely felismerte: a Duna, a Vltava és a Visztula mentén élő népek csak közös gazdasági szövetségben védhetik meg szuverenitásukat a birodalmi törekvésekkel szemben."
    },
    {
      "type": "narration",
      "text": "Ezt az ősi felismerést támasztotta fel 1991-ben Václav Havel, Antall József és Lech Wałęsa, amikor a szovjet elnyomás romjain megkötötték a Visegrádi Nyilatkozatot. A V4 nemcsak a Varsói Szerződés lebontásának lett a faltörő kosa, hanem a sikeres euroatlanti integráció kovácsa is: bizonyítva, hogy a térség elválaszthatatlanul a nyugati civilizációhoz tartozik."
    },
    {
      "type": "narration",
      "text": "Az évtizedek során a szövetség kézzelfogható fizikai valósággá érett: az észak-déli gáz-interkonnektorok és a Via Carpatia autópálya-folyosó megtörték a fél évszázados szovjet kelet-nyugati egyoldalúságot, megteremtve a Balti-, az Adriai- és a Fekete-tenger közötti Három Tenger Kezdeményezés gazdasági gerincét."
    },
    {
      "type": "narration",
      "text": "A 2022-es ukrajnai háború azonban a V4 történetének legsúlyosabb belső feszültségeit hozta felszínre: míg Lengyelország és Csehország a szabadság védelmének élvonalába állt, addig a magyar és szlovák politika eltérő stratégiai utakat keresett. A divergencia megmutatta, hogy közös biztonsági elköteleződés nélkül az intézményi keretek kiüresedhetnek."
    },
    {
      "type": "narration",
      "text": "Végeredményben Szűcs Jenő és Bibó István igazsága világítja meg a jövőt: Közép-Európa nem lehet 'kompország', sem a birodalmak prédájául szolgáló ütközőzóna. A visegrádi térség egyetlen méltó történelmi hivatása az európai szabadsághagyomány és a demokratikus jogállamiság szilárd őrzése: garantálva, hogy a Duna-kanyar szelleme a huszonegyedik században is a bátor, független és szolidáris nemzetek otthona maradjon."
    }
  ]
}
