{
  "id": "story.b1.nuevasrepublicas.01",
  "title": "Construir un Estado",
  "level": "B1",
  "lesson": 1,
  "order": 1,
  "type": "world",
  "estimatedMinutes": 6,
  "summary": "What building a state from nothing actually required — currencies, courts, a postal service — and the federal experiment that collapsed into five separate countries within eighteen years.",
  "characters": [],
  "location": "Centroamérica y América Latina",
  "grammar": [
    "se pasiva / impersonal: formación del Estado"
  ],
  "vocabularyTopics": [
    "Construir un Estado"
  ],
  "paragraphs": [
    {
      "type": "narration",
      "text": "Construir un estado moderno desde la nada fue una tarea titánica para las élites criollas victoriosas."
    },
    {
      "type": "narration",
      "text": "Cada nueva república intentó redactar su propia constitución, crear una moneda nacional y organizar un servicio de correo postal."
    },
    {
      "type": "narration",
      "text": "La falta de dinero era crítica: sin aduanas eficientes, cobrar el impuesto resultaba casi imposible en provincias lejanas."
    },
    {
      "type": "narration",
      "text": "El sueño de mantener una gran federación continental fracasó cuando Centroamérica y la Gran Colombia terminaron por disolverse."
    },
    {
      "type": "narration",
      "text": "Cada facción armada defendía sus propios intereses locales, dejando al joven país en un rumbo sumamente incierto."
    }
  ],
  "narration": {
    "durationSeconds": 35.2,
    "pacing": {
      "speedMultiplier": 1.0,
      "rate_str": "+0%",
      "rate_wpm": 150,
      "style": "natural, expressive"
    },
    "speakers": {
      "Narrator": {
        "role": "narrator",
        "gender": "neutral",
        "tone": "clear, warm, steady storytelling guide"
      }
    },
    "segments": [
      {
        "paraIndex": 0,
        "startTime": 0.0,
        "endTime": 6.4,
        "speaker": "Narrator",
        "lang": "es",
        "cues": [],
        "pronunciations": []
      },
      {
        "paraIndex": 1,
        "startTime": 6.4,
        "endTime": 14.0,
        "speaker": "Narrator",
        "lang": "es",
        "cues": [
          {
            "type": "pause",
            "durationMs": 250,
            "reason": "clause-boundary"
          }
        ],
        "pronunciations": []
      },
      {
        "paraIndex": 2,
        "startTime": 14.0,
        "endTime": 21.2,
        "speaker": "Narrator",
        "lang": "es",
        "cues": [
          {
            "type": "pause",
            "durationMs": 250,
            "reason": "clause-boundary"
          }
        ],
        "pronunciations": []
      },
      {
        "paraIndex": 3,
        "startTime": 21.2,
        "endTime": 28.4,
        "speaker": "Narrator",
        "lang": "es",
        "cues": [],
        "pronunciations": []
      },
      {
        "paraIndex": 4,
        "startTime": 28.4,
        "endTime": 35.2,
        "speaker": "Narrator",
        "lang": "es",
        "cues": [
          {
            "type": "pause",
            "durationMs": 250,
            "reason": "clause-boundary"
          }
        ],
        "pronunciations": []
      }
    ],
    "pedagogical": {
      "keyVocabulary": [
        {
          "lemma": "historia",
          "pos": "noun",
          "cefr": "B1",
          "gloss": "story"
        }
      ],
      "targetGrammar": [
        "se pasiva / impersonal: formación del Estado"
      ],
      "comprehensionQuestions": [
        {
          "question": "¿Cuál es el tema principal de «Construir un Estado»?",
          "options": [
            "What building a state from nothing actually required — currencies, courts, a postal service — and the federal experiment that collapsed into five separate countries within eighteen years.",
            "Una discusión sobre gramática",
            "Una receta de cocina tradicional",
            "Una carta formal de negocios"
          ],
          "correctIndex": 0,
          "explanation": "El texto desarrolla los eventos descritos en la narración."
        }
      ]
    }
  }
}