{
  "id": "b2-futuro-04",
  "title": "Cultura juvenil, redes y nuevos movimientos sociales ciudadanos",
  "level": "B2",
  "lesson": 4,
  "type": "world",
  "estimatedMinutes": 15,
  "summary": "El protagonismo de las juventudes latinoamericanas en la transformación de la esfera pública: la marea verde feminista, el estallido social, la música urbana contestataria y el activismo digital como herramientas de democratización radical.",
  "characters": [
    "Líderes estudiantiles y colectivos juveniles urbanos",
    "Músicos de la escena urbana independiente y activistas digitales"
  ],
  "paragraphs": [
    {
      "type": "narration",
      "text": "En un continente donde más de la mitad de la población tiene menos de treinta años, las juventudes latinoamericanas han irrumpido con una fuerza transformadora sin precedentes, redefiniendo las formas de participación política, la estética de la protesta y los consensos éticos de la sociedad contemporánea. Desencantados de las estructuras partidarias tradicionales y los pactos cupulares de las élites, los movimientos juveniles han ocupado las calles y las redes sociales con una vitalidad horizontal, festiva y radicalmente democrática, demostrando que la apatía no es un rasgo generacional, sino la respuesta lúcida ante un sistema institucional anquilosado que postergaba sus anhelos de futuro. Aunado a ello, la juventud actual ha forjado redes transnacionales de colaboración instantánea que trascienden las fronteras nacionales, compartiendo estrategias de autoprotección, consignas de movilización y herramientas de comunicación comunitaria."
    },
    {
      "type": "narration",
      "text": "Uno de los fenómenos más luminosos y de mayor irradiación global de esta primavera ciudadana ha sido la 'marea verde' feminista, nacida en Argentina al calor de la consigna 'Ni Una Menos' y expandida con velocidad fulgurante a Chile, México, Colombia y toda la región. Con pañuelos verdes anudados al cuello, cánticos corales y movilizaciones masivas que desbordaron las avenidas, millones de jóvenes lograron despenalizar la interrupción voluntaria del embarazo y consagrar la educación sexual integral, interpelando las raíces patriarcales de la sociedad y situando el cuidado, la autonomía corporal y la erradicación del feminicidio en el centro insoslayable del debate de Estado. En efecto, la fuerza desbordante de la marea verde demostró que las demandas de género no son reclamos sectoriales aislados, sino la piedra angular de una transformación democrática integral de la sociedad."
    },
    {
      "type": "narration",
      "text": "Asimismo, las movilizaciones estudiantiles y los estallidos sociales en Chile (2019) y Colombia (2021) pusieron de manifiesto el hartazgo colectivo frente a la desigualdad estructural, el encarecimiento de la educación superior y la precarización laboral juvenil. En Santiago y Bogotá, las marchas combinaron expresiones artísticas de asombrosa potencia poética —como la performance global 'Un violador en tu camino' del colectivo Las Tesis o las batucadas de resistencia en la 'Primera Línea'— con una firmeza cívica que obligó a iniciar procesos constituyentes y reformas sociales de calado histórico, demostrando que el arte urbano y la protesta pacífica son armas insustituibles de emancipación. Asimismo, la confluencia entre arte urbano, música experimental y demandas de justicia social ha revitalizado el espacio público metropolitano, transformando las plazas en laboratorios de ciudadanía activa y deliberación fraterna."
    },
    {
      "type": "narration",
      "text": "En el plano cultural, la música urbana contemporánea —desde el rap contestatario y el trap con identidad barrial hasta el neoperreo y la música de fusión afroindígena— se ha convertido en la banda sonora cotidiana de esta juventud rebelde. Artistas independientes rechazan la complacencia frívola para rimar sobre la violencia policial, la precariedad de las periferias metropolitanas, el orgullo de las raíces morenas y la salud mental. Lejos de ser un producto efímero de consumo masivo, esta expresión musical canaliza el pulso emocional de barrios donde la creatividad y el compañerismo triunfan cotidianamente sobre la exclusión. Por consiguiente, la apropiación creativa de las tecnologías digitales por parte de brigadas juveniles ha neutralizado las campañas de desinformación mediática, devolviendo a los ciudadanos el control sobre el relato público."
    },
    {
      "type": "narration",
      "text": "El activismo digital y el uso sagaz de las redes sociales han democratizado el acceso a la información, permitiendo a colectivos de derechos humanos y brigadas ambientales registrar abusos policiales en tiempo real y coordinar acciones de solidaridad comunitaria instantáneas. Las juventudes de nuestra América no esperan pasivamente que el futuro llegue de manos ajenas; lo están construyendo activamente con cada asamblea, cada mural callejero, cada verso rapeado y cada clic solidario. Su energía creadora es el latido más esperanzador de un continente que se niega a resignarse y avanza con valentía hacia un mañana de justicia y dignidad compartida. La rebeldía pacífica y la sensibilidad solidaria de las nuevas generaciones son la garantía más firme de que América Latina continuará marchando hacia un porvenir de libertad y equidad."
    }
  ],
  "narration": {
    "pedagogical": {
      "comprehensionQuestions": [
        {
          "question": "¿Qué representa la 'marea verde' nacida en el Cono Sur y expandida a toda América Latina?",
          "options": [
            "Un movimiento ecologista enfocado exclusivamente en la reforestación de pinos extranjeros.",
            "Una movilización feminista juvenil masiva por los derechos reproductivos, la autonomía corporal y el fin de la violencia machista.",
            "Una huelga de trabajadores de la industria del té verde.",
            "Un campeonato juvenil de vela deportiva."
          ],
          "correctIndex": 1
        },
        {
          "question": "¿Qué impacto decisivo tuvieron los estallidos sociales juveniles en Chile y Colombia?",
          "options": [
            "La clausura inmediata de todas las facultades universitarias.",
            "Visibilizar el malestar ante la desigualdad estructural y forzar debates constitucionales y reformas institucionales profundas.",
            "El traspaso de los fondos de pensiones a bancos privados extranjeros.",
            "La prohibición de las artes visuales en el espacio público."
          ],
          "correctIndex": 1
        },
        {
          "question": "¿Cómo se vincula la nueva música urbana independiente con las realidades de la juventud latinoamericana?",
          "options": [
            "Promoviendo el aislamiento individualista y el lujo desmedido sin conciencia social.",
            "Canalizando con honestidad el orgullo identitario barrial, la denuncia de la violencia y la resiliencia colectiva frente a la marginación.",
            "Traduciendo canciones comerciales anglosajonas de los años cincuenta.",
            "Eliminando los instrumentos acústicos y la percusión tradicional."
          ],
          "correctIndex": 1
        }
      ]
    }
  }
}